id	gene	entrez_id	variant	disease	doid	phenotypes	drugs	drug_interaction_type	evidence_type	evidence_direction	evidence_level	clinical_significance	evidence_statement	citation_id	source_type	asco_abstract_id	citation	nct_ids	rating	evidence_status	evidence_id	variant_id	gene_id	chromosome	start	stop	reference_bases	variant_bases	representative_transcript	chromosome2	start2	stop2	representative_transcript2	ensembl_version	reference_build	variant_summary	variant_origin	last_review_date	evidence_civic_url	variant_civic_url	gene_civic_url	is_flagged	variant_upper
2446	EGFR	1956	Exon 19 Deletion	Lung Non-small Cell Carcinoma	3908	NA	Erlotinib,Dacomitinib	Substitutes	Predictive	Supports	B	Sensitivity/Response	Non-small cell cancer patients from two studies [The ARCHER 1009 (NCT01360554) and A7471028 (NCT00769067)] with exon 19 deletion and L858R EGFR (Exon 21) mutations were pooled to compare the efficacy of dacomitinib to erlotinib. 121 patients with any EGFR mutation were enrolled, 101 had activating mutations in exon 19 or 21. Median progression-free survival and median survival were better following dacomitinib treatment (14.6 and 26.6 months, N=53) than erlotinib (9.6 and 23.2, P = 0.146 and P = 0.265, N=48). In exon 19 mutated patients (N=32 and 36) PFS was better for dacomitinib treated patients (HR of 0.585 [95% CI 0.335–1.024], two-sided log-rank, P = 0.058) but did not reach significance.	26768165	PubMed	NA	Ramalingam et al., 2016, Ann. Oncol.	NCT00769067,NCT01360554,NCT01774721	3	accepted	4859	133	19	7	55242415	55242513	NA	NA	ENST00000275493.2	NA	NA	NA	NA	75	GRCh37	Deletions within exon 19 of EGFR are most common in lung cancer. These deletions, in non-small cell lung cancer, have been shown to be sensitive to the EGFR tyrosine kinase inhibitors gefitinib, afatinib, and erlotinib. There is also data to suggest that this event is a good prognostic marker in lung adenocarcinoma. Examples of exon 19 deletions include: p.746_A750delELREA, p.747_753delinsS, p.747_752delLREATS, and p.747_751delLREAT.	Somatic	2017-07-27 21:58:24 UTC	https://civic.genome.wustl.edu/links/evidence_items/4859	https://civic.genome.wustl.edu/links/variants/133	https://civic.genome.wustl.edu/links/genes/19	FALSE	EXON 19 DELETION
2661	VHL	7428	Exon 1 Deletion	Von Hippel-Lindau Disease	14175	Hemangioblastoma	NA	NA	Predisposing	Supports	C	Uncertain Significance	Germline mutation analysis of seven east-Chinese families revealed 6 mutations. This mutation was found two separate VHL families. One family contained a male VHL type 1 patient with hemangioblastomas of the central nervous system and a male asymptomatic patient (family A). The other family contained two male VHL type patients with hemangioblastomas of the central nervous system and 4 asymptomatic family members (family E). This study contains very strong evidence for pathogenicity in the form of a single exon deletion variant in a gene where loss-of-function is a known mechanism of disease (ACMG code: PVS1).	21972040	PubMed	NA	Huang et al., 2012, Int. J. Mol. Med.	NA	2	accepted	5249	844	58	3	10183532	10183871	NA	NA	ENST00000256474.2	NA	NA	NA	NA	75	GRCh37	NA	Rare Germline	2022-01-12 17:35:32 UTC	https://civic.genome.wustl.edu/links/evidence_items/5249	https://civic.genome.wustl.edu/links/variants/844	https://civic.genome.wustl.edu/links/genes/58	FALSE	EXON 1 DELETION
2917	VHL	7428	Exon 3 Deletion	Von Hippel-Lindau Disease	14175	Renal cell carcinoma,Hemangioblastoma,Pancreatic cysts,Retinal capillary hemangioma	NA	NA	Predisposing	Supports	C	Uncertain Significance	Mutational analysis for 16 patients with clinically diagnosed VHL disease, revealed 12 germline mutations. This mutation was found in 3 family members and an unrelated patient. All three family members had hemangioblastomas of the central nervous system (proband no. 13). The 32-year-old sister and 27-year-old proband had renal cell carcinoma and pancreatic cysts. The proband also had retinal angiomas. The unrelated, 45-year-old VHL patient had hemangioblastomas of the central nervous system and retina, renal cell carcinoma, and pancreatic cysts (proband no. 14). ACMG codes as follows: A single exon deletion variant in a gene where loss-of-function is known mechanism of disease (PSV1). Cosegregation with disease in multiple affected family members in a gene definitively known to cause the disease (PP1).	22357542	PubMed	NA	Wu et al., 2012, J. Hum. Genet.	NA	2	accepted	5767	1939	58	3	10191471	10193904	NA	NA	ENST00000256474.2	NA	NA	NA	NA	75	GRCh37	NA	Rare Germline	2022-01-12 17:35:36 UTC	https://civic.genome.wustl.edu/links/evidence_items/5767	https://civic.genome.wustl.edu/links/variants/1939	https://civic.genome.wustl.edu/links/genes/58	FALSE	EXON 3 DELETION
3076	EGFR	1956	Exon 19 Deletion	Lung Adenocarcinoma	3910	NA	Gefitinib	NA	Predictive	Supports	B	Sensitivity/Response	A Japanese Phase III clinical study assessed the noninferiority of gefitinib in comparison to erlotinib in 561 patients with postoperative or recurrent stage IIIB/IV lung adenocarcinoma. Patients were pretreated with at least one chemotherapy regimen, but no tyrosine kinase inhibitors. In the subgroup of 156 patients with exon 19 deletions as their sole EGFR mutation, 83 and 78 were treated with erlotinib and gefitinib, respectively. Objective response (defined as complete + partial response) was approximately 65 percent for both erlotinib gefitinib and non significantly different  (p= .965). Disease control rate (defined as complete response + partial response + stable disease) was 91.6 and 83.3 percent for erlotinib and gefitinib, respectively (p=.113). The study was unable to demonstrate statistical noninferiority via the planned end point; however, the lack of statistically significant differences between erlotinib and gefitinib responses, and the milder adverse effects experienced by gefitinib treated patients, led the authors to conclude that gefitinib is a feasible alternative to erlotinib in treating patients with ex19del EGFR positive, advanced lung adenocarcinoma.	27022112	PubMed	NA	Urata et al., 2016, J. Clin. Oncol.	NA	3	accepted	6184	133	19	7	55242415	55242513	NA	NA	ENST00000275493.2	NA	NA	NA	NA	75	GRCh37	Deletions within exon 19 of EGFR are most common in lung cancer. These deletions, in non-small cell lung cancer, have been shown to be sensitive to the EGFR tyrosine kinase inhibitors gefitinib, afatinib, and erlotinib. There is also data to suggest that this event is a good prognostic marker in lung adenocarcinoma. Examples of exon 19 deletions include: p.746_A750delELREA, p.747_753delinsS, p.747_752delLREATS, and p.747_751delLREAT.	Somatic	2021-01-27 01:19:05 UTC	https://civic.genome.wustl.edu/links/evidence_items/6184	https://civic.genome.wustl.edu/links/variants/133	https://civic.genome.wustl.edu/links/genes/19	FALSE	EXON 19 DELETION
3104	VHL	7428	Exon 3 Deletion	Von Hippel-Lindau Disease	14175	Pancreatic cysts,Multiple renal cysts,Renal cell carcinoma,Hemangioblastoma,Endolymphatic sac tumor,Epididymal cyst	NA	NA	Predisposing	N/A	C	N/A	A 33Y male presented with multiple bilateral renal masses, epididymis cyst, pancreatic cysts and renal cysts. The patient previously underwent resections of medullary hemangioblastoma and endolymphatic sac tumors. Genetic evaluation by MLPA revealed a germline deletion of exon 3 in the VHL gene, confirming the diagnosis of VHL disease. Family history was unremarkable, and both parents tested negative for the mutation, suggesting the mutation occurred de novo in the patient. ACMG: PVS1 exon deletion, PS2 de novo mutation confirmed absent in parents, PP4 phenotype specific for disease	28256701	PubMed	NA	Allasia et al., 2017, Urologia	NA	2	accepted	6223	1939	58	3	10191471	10193904	NA	NA	ENST00000256474.2	NA	NA	NA	NA	75	GRCh37	NA	Rare Germline	2022-01-12 17:35:46 UTC	https://civic.genome.wustl.edu/links/evidence_items/6223	https://civic.genome.wustl.edu/links/variants/1939	https://civic.genome.wustl.edu/links/genes/58	FALSE	EXON 3 DELETION
3148	VHL	7428	Exon 3 Deletion	Von Hippel-Lindau Disease	14175	Pancreatic cysts,Pheochromocytoma,Clear cell renal cell carcinoma,Cerebellar hemangioblastoma,Retinal capillary hemangioma,Spinal hemangioblastoma	NA	NA	Predisposing	N/A	C	N/A	A 22-year-old woman diagnosed in childhood with type IIb VHL, with known multiple retinal angiomas, pancreatic cysts, and spinal and cerebellar hemangioblastomas presented to the ER with signs of acute decompensated heart failure leading to the discovery of dilated left ventricle with severely depressed ejection fraction. Pheochromocytoma and clear cell renal carcinoma was also discovered at this time. Genetic analysis revealed a de novo germline exon 3 deletion mutation in the VHL gene, with no family history of disease. ACMG: PVS1, PS2, PP4	26584481	PubMed	NA	Valero et al., 2016, Med Princ Pract	NA	3	accepted	6290	1939	58	3	10191471	10193904	NA	NA	ENST00000256474.2	NA	NA	NA	NA	75	GRCh37	NA	Rare Germline	2022-01-12 17:35:37 UTC	https://civic.genome.wustl.edu/links/evidence_items/6290	https://civic.genome.wustl.edu/links/variants/1939	https://civic.genome.wustl.edu/links/genes/58	FALSE	EXON 3 DELETION
3291	VHL	7428	Exon 1 Deletion	Von Hippel-Lindau Disease	14175	Endolymphatic sac tumor	NA	NA	Predisposing	Supports	C	Uncertain Significance	Patients with ELSTs were identified and included in the International Endolymphatic Sac Tumor Registry. The registry contained 93 patients as of July 2014, and of those, 25 were sporadic, and 68 associated with VHL.  statistics of the VHL subgroup is as follows: mean age 30, 62% female, 91% symptomatic, 54% with retinal angioma, 72% with CNS hemangioblastoma, 46% with renal cell carcinoma, 19% with pheochromocytoma, 12% with pancreatic neuroendocrine tumour. In the data from this study, only endolymphatic sac tumours can be confirmed as a phenotype for this mutation, which was found in 1 individual from the Netherlands.	25867206	PubMed	NA	Bausch et al., 2016, Head Neck	NA	3	accepted	6624	844	58	3	10183532	10183871	NA	NA	ENST00000256474.2	NA	NA	NA	NA	75	GRCh37	NA	Rare Germline	2022-01-12 17:35:39 UTC	https://civic.genome.wustl.edu/links/evidence_items/6624	https://civic.genome.wustl.edu/links/variants/844	https://civic.genome.wustl.edu/links/genes/58	FALSE	EXON 1 DELETION
3292	VHL	7428	Exon 2 Deletion	Von Hippel-Lindau Disease	14175	Endolymphatic sac tumor	NA	NA	Predisposing	Supports	C	Uncertain Significance	Patients with ELSTs were identified and included in the International Endolymphatic Sac Tumor Registry. The registry contained 93 patients as of July 2014, and of those, 25 were sporadic, and 68 associated with VHL.  statistics of the VHL subgroup is as follows: mean age 30, 62% female, 91% symptomatic, 54% with retinal angioma, 72% with CNS hemangioblastoma, 46% with renal cell carcinoma, 19% with pheochromocytoma, 12% with pancreatic neuroendocrine tumour. In the data from this study, only endolymphatic sac tumours can be confirmed as a phenotype for this mutation, which was found in 1 individual from France.	25867206	PubMed	NA	Bausch et al., 2016, Head Neck	NA	3	accepted	6625	1938	58	NA	NA	NA	NA	NA	NA	NA	NA	NA	NA	NA	NA	NA	Rare Germline	2022-01-12 17:35:39 UTC	https://civic.genome.wustl.edu/links/evidence_items/6625	https://civic.genome.wustl.edu/links/variants/1938	https://civic.genome.wustl.edu/links/genes/58	FALSE	EXON 2 DELETION
3293	VHL	7428	Exon 3 Deletion	Von Hippel-Lindau Disease	14175	Endolymphatic sac tumor	NA	NA	Predisposing	N/A	C	N/A	Patients with ELSTs were identified and included in the International Endolymphatic Sac Tumor Registry. The registry contained 93 patients as of July 2014, and of those, 25 were sporadic, and 68 associated with VHL. Statistics of the VHL subgroup are as follows: mean age 30, 62% female, 91% symptomatic, 54% with retinal angioma, 72% with CNS hemangioblastoma, 46% with renal cell carcinoma, 19% with pheochromocytoma, 12% with pancreatic neuroendocrine tumour. In the data from this study, only endolymphatic sac tumours can be confirmed as a phenotype for this mutation, which was found in 4 individuals from France, Germany, or Italy.	25867206	PubMed	NA	Bausch et al., 2016, Head Neck	NA	3	accepted	6626	1939	58	3	10191471	10193904	NA	NA	ENST00000256474.2	NA	NA	NA	NA	75	GRCh37	NA	Rare Germline	2022-01-12 17:35:44 UTC	https://civic.genome.wustl.edu/links/evidence_items/6626	https://civic.genome.wustl.edu/links/variants/1939	https://civic.genome.wustl.edu/links/genes/58	FALSE	EXON 3 DELETION
3294	VHL	7428	EXON 2-3 DELETION	Von Hippel-Lindau Disease	14175	Endolymphatic sac tumor	NA	NA	Predisposing	Supports	C	Uncertain Significance	Patients with ELSTs were identified and included in the International Endolymphatic Sac Tumor Registry. The registry contained 93 patients as of July 2014, and of those, 25 were sporadic, and 68 associated with VHL.  statistics of the VHL subgroup is as follows: mean age 30, 62% female, 91% symptomatic, 54% with retinal angioma, 72% with CNS hemangioblastoma, 46% with renal cell carcinoma, 19% with pheochromocytoma, 12% with pancreatic neuroendocrine tumour. In the data from this study, only endolymphatic sac tumours can be confirmed as a phenotype for this mutation, which was found in 1 individual from Germany.	25867206	PubMed	NA	Bausch et al., 2016, Head Neck	NA	3	accepted	6627	1940	58	NA	NA	NA	NA	NA	NA	NA	NA	NA	NA	NA	NA	NA	Rare Germline	2022-01-12 17:35:44 UTC	https://civic.genome.wustl.edu/links/evidence_items/6627	https://civic.genome.wustl.edu/links/variants/1940	https://civic.genome.wustl.edu/links/genes/58	FALSE	EXON 2-3 DELETION
3295	VHL	7428	Exon 1-3 Deletion	Von Hippel-Lindau Disease	14175	Endolymphatic sac tumor	NA	NA	Predisposing	N/A	C	N/A	Patients with ELSTs were identified and included in the International Endolymphatic Sac Tumor Registry. The registry contained 93 patients as of July 2014, and of those, 25 were sporadic, and 68 associated with VHL. Statistics of the VHL subgroup are as follows: mean age 30, 62% female, 91% symptomatic, 54% with retinal angioma, 72% with CNS hemangioblastoma, 46% with renal cell carcinoma, 19% with pheochromocytoma, 12% with pancreatic neuroendocrine tumour. In the data from this study, only endolymphatic sac tumours can be confirmed as a phenotype for this mutation, which was found in 6 individuals from France, Germany, the Netherlands, or Spain.	25867206	PubMed	NA	Bausch et al., 2016, Head Neck	NA	3	accepted	6628	843	58	3	10183532	10191649	NA	NA	ENST00000256474.2	NA	NA	NA	NA	75	GRCh37	NA	Rare Germline	2022-01-12 17:35:44 UTC	https://civic.genome.wustl.edu/links/evidence_items/6628	https://civic.genome.wustl.edu/links/variants/843	https://civic.genome.wustl.edu/links/genes/58	FALSE	EXON 1-3 DELETION
3564	DPYD	1806	EXON 11-19 DELETION	Head And Neck Squamous Cell Carcinoma	5520	NA	Fluorouracil,Leucovorin	Combination	Predictive	Supports	C	Sensitivity/Response	A 69 year old patient diagnosed with HNSCC presented with an unresectable neck mass three months after surgery and adjuvant radiation therapy. A biopsy was taken for whole genome and transcriptome analysis and the patient was started on systemic therapy. After showing resistance to the systemic therapy treatment with 5-FU and leucovorin was initiated based on the discovery of a somatic exon 11-19 in frame deletion in DPYD, which was hypothesized to increase sensitivity to 5-FU in the tumour. A dramatic clinical and radiographic response was sustained for 17 weeks, but following a 3 week treatment break a new nodule appeared. This recurrence showed resistance to re-initiation of treatment with capecitabine (oral 5-FU), and analysis of an additional biopsy provided no evidence as to the mechanism of resistance.	31871216	PubMed	NA	Majounie et al., 2019, Cold Spring Harb Mol Case Stud	NA	4	accepted	7787	2893	1526	1	97700408	98039526	NA	NA	ENST00000370192.3	NA	NA	NA	NA	75	GRCh37	NA	Somatic	2020-01-03 17:30:23 UTC	https://civic.genome.wustl.edu/links/evidence_items/7787	https://civic.genome.wustl.edu/links/variants/2893	https://civic.genome.wustl.edu/links/genes/1526	FALSE	EXON 11-19 DELETION
